[
  {
    "artifact_id": "alice_candidate_001",
    "schema_version": 1,
    "type": "character_image_candidate",
    "status": "locked",
    "content_hash": "sha256:golden-alice-001",
    "input_hash": "sha256:golden-alice-input",
    "dependencies": []
  },
  {
    "artifact_id": "alice_candidate_002",
    "schema_version": 1,
    "type": "character_image_candidate",
    "status": "candidate",
    "content_hash": "sha256:golden-alice-002",
    "input_hash": "sha256:golden-alice-input",
    "dependencies": []
  }
]
